{
  "dataset_name": "satimages",
  "activation": "LeakyReLU",
  "number_of_tests": 50,
  "seed": true,
  "method": "EXP_ORT",
  "mu": 0,
  "sigma": 0.1,
  "eq_neurons": {
    "connect4": [866, 866, 866],
    "isolete": [1050, 1050, 1050],
    "letter": [1200, 1200, 1200],
    "mnist": [5333, 5333, 5333],
    "mnist_fashion": [2000, 2000, 2000],
    "musk2": [520, 520, 520],
    "optdigits": [216, 216, 216],
    "page_blocks": [216, 216, 216],
    "satimages": [250, 250, 250],
    "segment": [216, 216, 216],
    "shuttle": [216, 216, 216],
    "spambase": [216, 216, 216],
    "usps": [866, 866, 866]
  },
  "exp_neurons": {
    "connect4": [2049, 452, 100],
    "isolete": [2000, 1500, 600],
    "letter": [2000, 1000, 600],
    "mnist": [8000, 5000, 3000],
    "mnist_fashion": [8000, 5000, 3000],
    "musk2": [1500, 750, 350],
    "optdigits": [325, 325, 325],
    "page_blocks": [300, 200, 100],
    "satimages": [2000, 1000, 600],
    "segment": [220, 220, 220],
    "shuttle": [400, 200, 50],
    "spambase": [400, 200, 50],
    "usps": [2049, 452, 100]
  }
}
